[
 {
  "id": "q-2026-10-16-a2a-version",
  "date": "2026-10-16",
  "record_id": "a2a",
  "kind": "version",
  "field": "version",
  "from": {
   "date": "2026-01",
   "label": "1.0.0"
  },
  "to": {
   "label": "1.0.1",
   "date": "2026-05-28"
  },
  "claim": "A2A v1.0.1 released on 2026-05-28 (v1.0.0 on 2026-03-12); governance is the Linux Foundation with a Technical Steering Committee of AWS, Cisco, Google, IBM Research, Microsoft, Salesforce, SAP and ServiceNow",
  "evidence_url": "https://github.com/a2aproject/A2A/releases",
  "detector": "phase-a@2026-10-15",
  "commit": "cc1b8ce363547aad11b3bb0bc69093a5362bfd81"
 },
 {
  "id": "q-2026-10-16-ag-ui-version",
  "date": "2026-10-16",
  "record_id": "ag-ui",
  "kind": "version",
  "field": "version",
  "from": {
   "date": null,
   "label": "protocol stable, packages versioned independently (e.g. @ag-ui/core on npm)"
  },
  "to": {
   "label": "1.0",
   "date": "2026-09-18"
  },
  "claim": "AG-UI 1.0 was released and frozen on 2026-09-18, with a published JSON Schema",
  "evidence_url": "https://github.com/ag-ui-protocol/ag-ui/discussions/2792",
  "detector": "phase-a@2026-10-15",
  "commit": "cc1b8ce363547aad11b3bb0bc69093a5362bfd81"
 },
 {
  "id": "q-2026-10-16-mcp-apps-version",
  "date": "2026-10-16",
  "record_id": "mcp-apps",
  "kind": "version",
  "field": "version",
  "from": {
   "date": "2026-01-26",
   "label": "npm package @modelcontextprotocol/ext-apps, spec dated 2026-01-26"
  },
  "to": {
   "label": "spec 2026-01-26; SDK ext-apps v2.0.3",
   "date": "2026-09-25"
  },
  "claim": "MCP Apps SDK ext-apps v2.0.3 was released on 2026-09-25 (spec dated 2026-01-26)",
  "evidence_url": "https://github.com/modelcontextprotocol/ext-apps/releases",
  "detector": "phase-a@2026-10-15",
  "commit": "cc1b8ce363547aad11b3bb0bc69093a5362bfd81"
 },
 {
  "id": "q-2026-10-16-a2ui-status",
  "date": "2026-10-16",
  "record_id": "a2ui",
  "kind": "status",
  "field": "governance",
  "from": "a2ui-project (Google-originated, open-source on GitHub; Apache-2.0)",
  "to": "a2ui-project GitHub organisation (moved from google/A2UI)",
  "claim": "A2UI moved from google/A2UI to the a2ui-project GitHub organisation",
  "evidence_url": "https://github.com/a2ui-project/A2UI",
  "detector": "phase-a@2026-10-15",
  "commit": "cc1b8ce363547aad11b3bb0bc69093a5362bfd81"
 },
 {
  "id": "q-2026-10-16-agent-client-protocol-version",
  "date": "2026-10-16",
  "record_id": "agent-client-protocol",
  "kind": "version",
  "field": "version",
  "from": {
   "date": "2026-07-20",
   "label": "v1 (stable); v2 draft"
  },
  "to": {
   "label": "v1.11.0 (schema v1.25.0); v2 unstable",
   "date": "2026-10-09"
  },
  "claim": "Agent Client Protocol v1.11.0 (schema v1.25.0) released on 2026-10-09; v2 is unstable",
  "evidence_url": "https://github.com/agentclientprotocol/agent-client-protocol/blob/main/CHANGELOG.md",
  "detector": "phase-a@2026-10-15",
  "commit": "cc1b8ce363547aad11b3bb0bc69093a5362bfd81"
 },
 {
  "id": "q-2026-10-16-adcp-version",
  "date": "2026-10-16",
  "record_id": "adcp",
  "kind": "version",
  "field": "version",
  "from": {
   "date": "2026",
   "label": "3.1.20"
  },
  "to": {
   "label": "v3.2.4",
   "date": "2026-10-12"
  },
  "claim": "AdCP v3.2.4 released on 2026-10-12",
  "evidence_url": "https://github.com/adcontextprotocol/adcp/releases",
  "detector": "phase-a@2026-10-15",
  "commit": "cc1b8ce363547aad11b3bb0bc69093a5362bfd81"
 },
 {
  "id": "q-2026-10-16-anp-version",
  "date": "2026-10-16",
  "record_id": "anp",
  "kind": "version",
  "field": "version",
  "from": {
   "date": null,
   "label": "1.1 (protocol document release); protocolVersion field remains 1.0.0"
  },
  "to": {
   "label": "v1.2",
   "date": "2026-09-24"
  },
  "claim": "Agent Network Protocol v1.2 released on 2026-09-24",
  "evidence_url": "https://github.com/agent-network-protocol/AgentNetworkProtocol/releases",
  "detector": "phase-a@2026-10-15",
  "commit": "cc1b8ce363547aad11b3bb0bc69093a5362bfd81"
 },
 {
  "id": "q-2026-10-16-oasf-version",
  "date": "2026-10-16",
  "record_id": "oasf",
  "kind": "version",
  "field": "version",
  "from": {
   "date": null,
   "label": "1.1.0 (also serving 0.7.0, 0.8.0, 1.0.0)"
  },
  "to": {
   "label": "v1.1.0",
   "date": "2026-07-10"
  },
  "claim": "OASF v1.1.0 released on 2026-07-10",
  "evidence_url": "https://github.com/agntcy/oasf/releases",
  "detector": "phase-a@2026-10-15",
  "commit": "cc1b8ce363547aad11b3bb0bc69093a5362bfd81"
 },
 {
  "id": "q-2026-10-16-ap2-version",
  "date": "2026-10-16",
  "record_id": "ap2",
  "kind": "version",
  "field": "version",
  "from": {
   "date": null,
   "label": "v0.2"
  },
  "to": {
   "label": "v0.2.0",
   "date": "2026-04-28"
  },
  "claim": "AP2 v0.2.0 released on 2026-04-28, and AP2 was donated to the FIDO Alliance (Payments TWG and Agentic Authentication TWG) the same day",
  "evidence_url": "https://github.com/google-agentic-commerce/AP2/releases",
  "detector": "phase-a@2026-10-15",
  "commit": "cc1b8ce363547aad11b3bb0bc69093a5362bfd81"
 },
 {
  "id": "q-2026-10-16-x402-status",
  "date": "2026-10-16",
  "record_id": "x402",
  "kind": "status",
  "field": "governance",
  "from": "x402 Foundation, a Series of LF Projects, LLC (Linux Foundation); operational launch announced 2026-07-14",
  "to": "x402 Foundation, a Series of LF Projects, LLC (Linux Foundation); operational launch announced 2026-07-14; Executive Director Michael Hursta from 2026-10-01; 50+ members",
  "claim": "The Linux Foundation appointed Michael Hursta as executive director of the x402 Foundation, effective 2026-10-01; the foundation has 50+ members",
  "evidence_url": "https://www.linuxfoundation.org/press/linux-foundation-appoints-michael-hursta-as-executive-director-of-the-x402-foundation",
  "detector": "phase-a@2026-10-15",
  "commit": "cc1b8ce363547aad11b3bb0bc69093a5362bfd81"
 },
 {
  "id": "q-2026-10-16-mpp-revision",
  "date": "2026-10-16",
  "record_id": "mpp",
  "kind": "revision",
  "field": "spec_url",
  "from": "https://mpp.dev/protocol",
  "to": "https://datatracker.ietf.org/doc/html/draft-httpauth-payment-01",
  "claim": "The MPP draft was renamed draft-httpauth-payment; draft-httpauth-payment-01 is dated 2026-09-09",
  "evidence_url": "https://datatracker.ietf.org/doc/draft-httpauth-payment/",
  "detector": "phase-a@2026-10-15",
  "commit": "cc1b8ce363547aad11b3bb0bc69093a5362bfd81"
 },
 {
  "id": "q-2026-10-16-ucp-status",
  "date": "2026-10-16",
  "record_id": "ucp",
  "kind": "status",
  "field": "evidence",
  "from": null,
  "to": null,
  "claim": "UCP added a Payments Technical Council (2026-09-02), a Lodging Booking draft capability (2026-09-25) and Merchant Center cart transfer (2026-09-16)",
  "evidence_url": "https://github.com/Universal-Commerce-Protocol/ucp/releases",
  "detector": "phase-a@2026-10-15",
  "commit": "cc1b8ce363547aad11b3bb0bc69093a5362bfd81"
 },
 {
  "id": "q-2026-10-16-slim-revision",
  "date": "2026-10-16",
  "record_id": "slim",
  "kind": "revision",
  "field": "version",
  "from": {
   "date": null,
   "label": "IETF individual draft draft-mpsb-agntcy-slim-00; active GitHub development"
  },
  "to": {
   "label": "draft-mpsb-agntcy-slim-02",
   "date": "2026-07-19"
  },
  "claim": "draft-mpsb-agntcy-slim-02 is dated 2026-07-19",
  "evidence_url": "https://datatracker.ietf.org/doc/draft-mpsb-agntcy-slim/",
  "detector": "phase-a@2026-10-15",
  "commit": "cc1b8ce363547aad11b3bb0bc69093a5362bfd81"
 },
 {
  "id": "q-2026-10-16-daap-revision",
  "date": "2026-10-16",
  "record_id": "daap",
  "kind": "revision",
  "field": "version",
  "from": {
   "date": "2026-08",
   "label": "draft-mishra-oauth-agent-grants-02"
  },
  "to": {
   "label": "draft-mishra-oauth-agent-grants-02",
   "date": "2026-08-30"
  },
  "claim": "draft-mishra-oauth-agent-grants-02 is dated 2026-08-30",
  "evidence_url": "https://datatracker.ietf.org/doc/draft-mishra-oauth-agent-grants/",
  "detector": "phase-a@2026-10-15",
  "commit": "cc1b8ce363547aad11b3bb0bc69093a5362bfd81"
 },
 {
  "id": "q-2026-10-16-adp-revision",
  "date": "2026-10-16",
  "record_id": "adp",
  "kind": "revision",
  "field": "version",
  "from": {
   "date": "2026-06-18",
   "label": "draft-pro-adp-agent-discovery-02"
  },
  "to": {
   "label": "draft-pro-adp-agent-discovery-02",
   "date": "2026-07-24"
  },
  "claim": "draft-pro-adp-agent-discovery-02 is dated 2026-07-24",
  "evidence_url": "https://datatracker.ietf.org/doc/draft-pro-adp-agent-discovery/",
  "detector": "phase-a@2026-10-15",
  "commit": "cc1b8ce363547aad11b3bb0bc69093a5362bfd81"
 },
 {
  "id": "q-2026-10-16-agents-json-dormant",
  "date": "2026-10-16",
  "record_id": "agents-json",
  "kind": "dormant",
  "field": "phase",
  "from": "draft",
  "to": "deprecated",
  "claim": "agents.json is dormant: last push 2025-08-21, version 0.1.0",
  "evidence_url": "https://github.com/wild-card-ai/agents-json",
  "detector": "phase-a@2026-10-15",
  "commit": "cc1b8ce363547aad11b3bb0bc69093a5362bfd81"
 },
 {
  "id": "q-2026-10-16-web-agent-protocol-dormant",
  "date": "2026-10-16",
  "record_id": "web-agent-protocol",
  "kind": "dormant",
  "field": "phase",
  "from": "draft",
  "to": "deprecated",
  "claim": "Web Agent Protocol is dormant: last commit 2025-06-03",
  "evidence_url": "https://github.com/OTA-Tech-AI/web-agent-protocol",
  "detector": "phase-a@2026-10-15",
  "commit": "cc1b8ce363547aad11b3bb0bc69093a5362bfd81"
 },
 {
  "id": "q-2026-10-16-agent-communication-protocol-status",
  "date": "2026-10-16",
  "record_id": "agent-communication-protocol",
  "kind": "status",
  "field": "phase",
  "from": "withdrawn",
  "to": "deprecated",
  "claim": "IBM's Agent Communication Protocol is deprecated (merged into A2A)",
  "evidence_url": "https://github.com/i-am-bee/acp",
  "detector": "phase-a@2026-10-15",
  "commit": "cc1b8ce363547aad11b3bb0bc69093a5362bfd81"
 },
 {
  "id": "q-2026-10-16-agent-connect-protocol-status",
  "date": "2026-10-16",
  "record_id": "agent-connect-protocol",